text,locale,ant-IN,ant-UK
bus drivers are a menace.,2,1,2
I love farm shows and one of the farmers on a doc sold their fleece for insulation.  As a wool / sheep fan I just said OMG how is that possible.  Thanks for the confirmation,2,2,0
Sensors are trying to shame India! These sensors are part of the Tukde tukde gang!,1,1,1
"Hi , I'm from Brisbane Queensland, I have visited Toowoomba on many occasions and it is not a good place to live in my opinion. I found the people rude and heard someone get racially abused twice in one day and many homophobic slurs also there is not much to do. Port Macquarie would be the best option if you love the beach. Bunbury would be the best option if you prefer a quieter place. :)",0,0,0
"Agrivoltaics is the answer. However, that land and soil is going to be preserved for another 50-100 years and saved from erosion. 

If you don't know what I'm talking about, go and ask farmers in the Fens, how much black soil they have left.",2,3,2
"Thank you so much for your suggestion, it really means a lot, I'm going to talk to my dad about this idea , hope he likes this idea. Thank you!!",1,3,0
"Attacking Labour shows he is still missing the point. He's not yet proven what he _can_ do for Britain. How is he going to fix the problems we have? If his election strategy is to simply attack the opposition, he's already lost,",2,2,2
"A culture of service is a good thing for our country' as he sneaks out the door.

What a shit.",2,3,2
What happened the last time an Australian PM made moves to decouple from the US (including Pine Gap)?,0,0,0
"Needless story to have dragged into the election, party is rumoured to have sat on this for months too.",2,2,2
"I'm trying to go here to work, I'm from EU and a physiotherapist, but I can't seem to find jobs as a bad 5 even with 5 years of experience. I've just been getting rejected. So not only the unskilled workers are facing a hard time getting jobs",2,2,2
"> Then they're backed into a corner with policy I'm sure they know deep down is bad and commit to it..


Very rarely do they care about promises made during an election cycle.


All that really matters is how much money can they funnel to their mates and this is one berry very ripe for the picking for decades!",0,3,2
Job security is a hella of a drug,1,3,2
"Bro you think watermelon is cheap, and you still have no AC ?",1,1,0
"No you're wrong. Ukraine invaded Russia. Didn't you know, poor Russia is innocent and it is the Wrst who are war hungry animals",2,1,2
"""You guys are saving?” Im living on the breadline. Welp another 55 hour week incoming. 

Joke of a country.",2,0,2
"This is turning into Bangkok. What's next? Recruit monkeys? Assholes, leave the kids out of this shit.",2,1,2
"lol dutton can't even get nsw liberals onboard with this brainfart of a policy,nationals are threatening to block it,and still 7 months after the policy was promised,no costs,or details..

this entire things a fucking shitshow.",0,2,0
A fixed wealth tax so in twenty years we all pay it. Why not concentrate on wealth creation?,2,3,3
"NATIONALISE!!!

Im shocked this issue hasn't triggered mass protesting",2,0,3
You are mistaking apathy for tolerance.,0,3,3
Lucky chap,1,2,2
I always assume it's just one of those people that has some obscure and horrendously diluted uranium pennystock that they think will pump if they can sell the nuclear debate. They are a dime a dozen these days.,0,3,2
Military use so much drugs that all that stuff you said is meaningless,2,3,2
Do you have a better solution. Would you rather go private if you need surgery paying a few grand.,2,2,2
What a rag,2,3,0
Given their odds they can promise everyone gets a bugatti and a blowjob. They can't deliver it nor will they be in a position to. They can just say they promised it and point the finger when reality sets in.,2,3,2
">This is never going to be ""front and centre” of the July GE. Starmer knows it's divisive and he'd alienate many of the votes he's keen to capture

And yet, he was one of the main people who pushed for a ""peoples vote"" to be included in the Labour 2019 manifesto.",2,2,2
You slaaaaaaaag!,2,3,2
tell him to write an essay on traffic rules as well,1,1,2
"An accurate, well-structured and dignified statement - that really shouldn't even need to be made.",0,3,2
When you let the infection spread for 5 years.,1,3,3
"Good work, cross post to r/Delhi",1,1,1
This is my go to for anytime this comes up.,1,1,3
Nice one.,1,3,3
Oh God I hate this woman so much,1,3,2
"Even calling it a circus has given it some respect. In India, these conferences are just a place for having tea and pakoras and boosting the ego in front of some illiterate politician. It's an example of the blind leading the blind there.

Many of these conferences have essentially turned into hubs for extramarital affairs.",1,1,1
Dukh. Dard. Sharam,1,1,1
"People in the comments are normalising this behaviour, because I guess a lot of people are capable of doing this.",1,3,2
"Such a shame, Radiohead helped me through some rough times. I'm more than happy to boycott these Zionist genocide-cheering pigs though, any relief these guys gave me is outweighed by their emergent inhumanity and lust for Zionist funds.",2,3,2
"People in the UK are afraid to criticise the NHS, it's garbage and that is because it has been underfunded and also because it is badly run. 

It really worries me as I get older having to rely on the NHS. The staff are not all angels, like any organisation you have many who cannot do their jobs and are lazy.",2,2,2
"Interesting that it says Labor could lose Robertson; it'd be the first time since 1980 that it backed a candidate from the Opposition party.

Minority government is probably the most likely outcome for the next election. Labor probably aren't in much danger of losing the election outright, but you'd have to think they'll need to concede a few things to stay in power.",2,2,2
"Well the government keeps cutting funding for mental health, outreach programs and people keep opposing anything drug support related in their neighborhoods or in the CBD. 

Not a surprise we have problems with homeless, mentally ill or drug addicted people in our streets. No one wants to wear the costs to solve the problems.",0,0,0
"Ubala hua anda maang rahi hai. Ek kaam karo isko ubla hua paani dedo, puche toh bolna anda andar pighal gaya.",1,1,1
"Insert ""Bhaiya galti se mere muh se nikal gaya” meme.",1,1,1
Probably because it didn't fit in a lot of ATMs,1,1,2
"I wouldn't bother to pick it up or let them know hahaha even if so, I would let them know but never pick myself coz I m germaphobic myself lol",2,3,2
"They are free to resign from their govt job. These govt babus always complain, they want everything served to them on a platter. Even once in a year they dont want to work hard",1,1,1
Is /r/Melbourne just a Google alternative these days?,0,0,0
"Mate DSP is already way higher than jobseeker as it is.


And in turn, jobseeker is higher than student payments and youth allowance.


Either increase jobseeker and youth allowance and students... or just increase everything.",0,3,2
Why would she get beaten up? Does anyone know the reason?,1,3,3
wish they hadnt told me I had cancer ...,2,3,3
"It is a bit mad that we're the words biggest exporter of legal medical cannabis, but everyone's still so uptight about it. I guess it's a money thing, relax the laws and introduce competition, and people like Theresa May who have a stake in it lose out on some profit",2,2,2
"In the US Alexandria Ocasia Cortez got a few million in grass roots donations.

Right wing (and some left) were loosing their shit saying things like ""She's now answerable to a small minority of activists"". The (purposeful) irony.",2,3,2
"If only we had politicians that acted on the public's concerns. 

Instead ours line their own pockets and offer no forward thinking.",0,3,3
"Who the f is this reporter who is saying don't compare heroines with light boys.
Why is she throwing a shade on light boys.",1,1,0
"Yes. I'm not sure about the satellite hubs but it seems everyone in Australia - bar the major parties - is keen on fossil fuel and other mineral \[but particularly gas and coal\] tax imposts. According to QandA's speakers, and audience, last night; we get close to diddly from our exports.",0,0,0
"Talk lately of conscription, having a store of food and water, and now drug shortages. I wonder if the writing on the wall to those in charge is that shits really going south and soon.",2,2,2
"I agree with Nitish Kumar. 

Gujarat needs its CM back. The current model isnt working.",1,1,1
"There are Muslims who pride themselves as Indians first. But they are as liberal as they come. Gives importance to secular education as well as religious education, don't blindly follow wahabism or Arab culture, they take part in other religious festivals where whole community is involved. 

Depending on which kind of Muslim you ask above listed could be blasphemy or against their religion. Such people exist in all religions. 

 But yaa their overall impact on world recently isn't that good and they don't want to admit it.",1,1,2
Get someone who looks at you like:-,1,3,3
"Indians completely abuse the system, it's the absolute truth and no body can deny it. I was part of it at one point of my life, used to scam the hell out of Uber Eats when it was there. I feel disgusting that I even did that. Now imagine, how many more people are doing it on the regular.

There should be some scope to get an item returned I believe, it is necessary for all the genuine cases. But I can't really blame the companies here.",1,1,2
"Har do mahine mein yeh news ata hai
Ab shaam ko dikhenge ek saath bastian se nikalte huye ya jate huye",1,1,1
So let's get rid of elite schools for elite minds which are likely to raise bar of average nationwide and dumb the population down to where they can more easily be controlled by dogma. If it were not so stupidly myopic it would be comical.,2,3,0
It must have been like hell for the poor woman.,1,3,3
Adrian Quist or Snakes Hissed for when one had excessively imbibed in alcoholic beverages.,0,3,2
Ik! I was mess. Abhi bhi hu but sayad thoda kam,1,1,1
Kiara was good in Shershah it felt so real,1,1,1
Definitely my favourite,1,3,3
"War brings in lots of money and the beneficiaries are not going to give it away, are they. Once the war ends they get money for redevelopment of the country they sold the arms to fight the war. 
Only losers are the tax payers. We don't have money to support the poor and needy, we don't have money to support the NHS and we don't have money to fight the crime in our own fking land but have plenty to help everyone else out there. 

My rant over",2,2,2
"It your own thermometer at the store. Hang it on the wall in the shade. If you want to know the wet bulb temp, stick a wet piece of cotton around the bulb. Wet bulb over 35 C can kill you. 31 can kill you if you are working.",2,2,3
"Can attest to Suitor being a great place to hire from. When I last used them they sent me a brand new suit for hire, still had its tags on.",0,3,2
Department of Honesty aka DoH!,0,0,0
Are we just supposed to be wearing some sort of Genocide Blinkers at this point? Our governments are taking the piss.,2,3,2
Because most of them got nothing else to do in their sad pathetic lives,1,3,3
"The real income is power and facilities provided by the govt..!  
My uncle become a magistrate judge last year..!  He gets 1.5L starting salary. !  Interest free loan for buying a car..!  60 litres of fuel every month.. 6000 units of electricity every year..!     He has got enormous marriage proposals worth 5-10 crores..!  But my poor uncle was rejected by his Brahmin girlfriend's family..!",1,1,0
"Has there ever been a liberal policy the experts supported? Business and mining council yes,anyone looking at Australians best interests? No",0,0,0
"Stopping middle of the road on Seacliff bridge to take photos.

It has fucking parking bays for this. Get out and walk a tad to get the perfect photo. 

Bitching at me about the prices of things, who told you Australia was cheap? Your in a bar.. you want the beer you pay for it like the rest of us. Or that the tap beers aren't ones you like... 99.9% of our customers like them that's why they are on tap. 

Ordering coffee like it's Starbucks at a normal cafe and getting mad at the staff because you got what we thought you meant because you refused to clarify. 

Fucking wait for people to get off the bus/train and stop trying to force your way on. They'll wait for you. Literally they will wait until everyone is on. 

Bitching at me that your bank card that is not one that does international shit like a MasterCard won't work here. We don't have your bank here... Why did you not get a MasterCard?",0,3,0
Albo finally saying the loud part out aloud lol,0,0,0
"Indian eyes are turned to the past. It's a culture based on tradition. Western eyes are turned to the future. 

All things in the past are not good nor should their lessons be forgotten.

The future is hazy and unknown and full of risks. 

Both should be considered in a conscious manner. Most people are creatures of habit not consciousness.",1,1,3
Banger username.,2,3,0
"How's your hay fever? I stopped taking my antihistamines a couple of days ago and my allergies came back. I'm usually fine between May and September, so I dunno what's changed this year. Anyone else feeling it?",0,3,2
"I blagged a flight in an RAF Sea King once and I can still vividly remember the smell now, hot exhaust fumes just constantly blasting through the fuselage, absolutely horrible. 

I did think at the time that it cannot be good for you!",2,2,2
"I've always been partial to 'Fuck a duck', it has so many uses.",0,3,2
In reality him and his mates have finished pillaging the public purse.,2,3,2
"Calling themselves Labour nowadays is a joke, Diet Tories more like",2,2,2
Alot of the guys who were known bullies at my school now doing time. Don't know anyone who would meet that criteria who has done remotely well.,2,0,2
What would it mean to reject something not based on cold hard facts? What would cold hard facts look like and how would one determine that?,0,3,0
"Yeah it was  although some days it probably annoyed him I chatted a lot, I was very good at my job. Plus he didn't mind a bit of a cheat himself, unless he was hungover",0,3,0
"I don't disagree with the quantity.

I disagree with the brand.",1,3,3
Brexshit,2,2,2
"Sad. But at least it's the owner that paid the ultimate price and not some innocent bystander.

Sad also for the animal, that will be put down.

Why people feel they need to own killing machines, I will never know.",1,3,2
They know they won't win. They're ransacking the place so that labour will inherit a shitstorm and promptly do fuck all about it but whine.,2,3,2
"Bullshit article. If you like it, watch it. If you don't like it, don't watch it. Your sex or sexuality doesn't mean you can't enjoy/watch shows that weren't made for your specific sex or sexuality (which is every TV programme).",2,3,2
Jayanagar layout was Asia's largest planned layout. It's so great to stay in this layout. No water Shortage. Only if we copied this layout all over bangalore,1,1,1
Where is the completely hapless Pesutto and Victorian Liberal opposition. Labor are in the media everywhere for all of the wrong reasons and he is doing nothing.,0,0,2
"Ranbir was the IT boy during that time... Top most Actors and Directors were dying to work with him!! Rockstar,YJHD,Barfi in a span of a year is INSANE...",1,1,1
"""Imagine a white European saying that about another ethnicity or religion""

 ...

 ""Imported people""

Double standards much?  

Also, ""Imported"" implies that someone has paid to have them shipped here. They may have migrated, they may even have been traficked but they definately have not been imported.",2,1,0
"I think they were teenagers...she is a hindu and he, a muslim. they ran away and got married in court quietly, Aamir's idea. If he is a narc who cares only about himself, then he's the a-hole with a roaming eye. He did the same to Kiran but that was worse cause Fatty was literally living in their home.",1,1,1
Victoria seriously needs a competent opposition. The flagrant fiscal mismanagement of state labor is ridiculous eg accepting comm games. Yet the majority of the public give them a pass,0,2,0
"Hmm. Nautica has been the lads' clothing of choice for over thirty years and is the only brand you've mentioned that evokes themes of lads. Tommy and Ralph Lauren are too big to be influenced by teenagers trying to be hard, and if history has proved anything, the Nautica brand hasn't suffered, either.",0,3,0
"Filing a baseless FIR against a lawyer? Lmao, he would shred the responsible police officers' explanation to pieces in court.",1,1,0
"The massive corpo I work for have rolled out WTC before each meeting because Lloyd's of London in the UK said they wouldn't provide us with reinsurance unless we improved our ESG score. 

As an insurance company which neither owns any infrastructure or manufactures anything physical, the E (environmental) bit is difficult to do anything about or improve. As for the G (governance), the executive team aren't willing to invest the time and expense of restructuring and we are already very highly regulated. Therefore that only leave S (social). 

It's been inexpensive to throw up a few rainbow flags around the office and implement WTC. It's shallow and meaningless imo but keeps our reinsurance premiums down. 

As someone who fully supports indigenous rights, opportunities and recognition, I'd be far more proud if my company paid for scholarships to young indigenous people looking to enter the corporate environment but that's expensive.",0,0,2
"This generation of boys is a lost cause. It's time we start urging our girls to completely distance themselves from them. 

Just to top it off, watch them get away with a tepid punishment for this.",2,3,2
"Friend of mine had it published she was shagging another bloke when her ex rolled up and beat him to death and her half to death. 

She certainly wasn't shagging him but because the killer said that was his motivation once they ran eith it ever since. Fuck the media",2,2,2
Waiting for him to put his finger on some African country,1,3,3
Eshays have always worn nautica and polo. There are certain styles within those brands that appeal to certain types of fuckwits.,0,0,0
Not so Pyara Advani,1,1,1
"I prefer Kid Starver, no point even implying he's remotely left wing.",2,3,2
"I still remember when the US was claiming it didn't want to extradite him from Sweden and people were saying he was a coward for not offering himself to the Swedish authorities.


A decade later, after hiding out most of that time, the US are trying to extradite him. I guess he had valid reasons for not coming forward.",0,3,2
Certificate in concreting,0,3,3
"The English should be proud of their rich heritage and the many, many gifts to civilization that came from their island. Had you not so fully committed to liberalism, I would have nothing but respect for your country. Nonetheless, be proud. 

A German",2,2,2
"Bohot Khoobsurat.
Jai Bajrang Bali.",1,1,1
They are still going strong.. I thought they would fizzle out after Archie's release,1,1,3
"Broken Hill as others have said is fascinating. Really like it. Camped at the race course, and then Lake Mungo. 

Something different - Take the Castlereagh Highway to Lightning Ridge/Grawin for Opal, visit the Brewarrina Fish Traps. Time your trip for the October Long weekend, and go to the Let's Dance Carinda David Bowie festival. I've been three times from Canberra.
Coonabarabran has a really good optical telescope, with fun educational Solar System markers en route, where the ""Sun"" is the telescope. The Narrabri Radio Telescope is not as iconic as Parkes, but it is it enormous, with six full sized dishes on railway tracks. Also look for some Artesian baths on whatever route you take up that way.",0,0,0
Once bins are on the curb it's legal to put stuff in them. So just wait for bin night to do it.,0,0,2
Is it able to be linked to the ServiceVIC App?,0,0,0
Best JR meme ever.,2,3,0
*Did they try not being poor though?*,2,3,2
"Thank you very much for your detailed and quality explanation, I'll definitely look into Falls Creek. My visitors they don't often get to experience skiing where they are, so travelling a bit further but for a better experience is definitely a good trade off.",0,3,0
"Not sure about that, the place has always been very sketchy. My dad had stories from over 50 years ago about that place.",0,3,0
"There are a few more than handy suggestions here already. Since you're already in the grind with academics, my suggestion to you would be to learn a couple of foreign languages and look at freelance gigs to start with. Eventually gain enough credentials to teach one of them.",0,3,2
"u/Caveboy_ ko iss diggaz pratibha kliye पांच rupiye (5 INR only) ka nagad eenam Diya jata hai. 


stage pe aakar apne eenam ki rashi le jaye.",1,1,1
A good economic policy from Reform UK. Has Hell frozen over?,2,2,2
"So no more Covid jabs, hmmmm....
They found a way for you to take it again 
Sheeple will follow....",0,2,2
We used to get so much shit just for washing our PPE. Shiny new stuff is bound to make you a pariah in some workplaces.,0,3,2
Good. There's [many]( studies showing Corporate tax [falling heavily on consumers and employees](,0,1,2
"How sad for both involved. The push was retaliation rather than defence; but generally just a bad decision made in the moment.

A smackhead once flicked a lit ciggy end in my face, he was walking the opposite way so I turned ran up behind him and only after I closed the distance did I stop my self from punching him in the back of the head, likely breaking my hand and potentially killing him.

I've been in more than a few scraps, but I've rarely ever in my life been just that upset over something. I was pissed off because of having a ciggy flicked at me but that didn't compare to the days maybe even weeks after thinking  about how bad that could have been. To do something so stupid. Not only was it terrifying and horrible to think I could have killed him but embarrassing to think that I'd ruin my life and hurt everyone around me over something like that. 

That's a moment where I can say I truly grew up and if it had happened years before, as angry and aggressive as I could be towards people who I felt deserved it, I might have made the wrong choice.

Which is why I feel sorry for that young girl. If she has empathy then she doesn't need prison as she'll carry this for the rest of her life.",0,3,0
Jail time just isn't given to most ppl unless it's one of the not allowed on Reddit opinions,2,3,2
"I was so mad when I saw that a couple of weeks ago. We came in specifically to see the shot tower, and instead we got… that.",0,3,2
"Consider which skills you have that may be transferrable. 

I would say that the ability to work under pressure, and the ability to clearly and succinctly communicate are two skills that are transferrable into almost any other career.

You already have in-depth insight into hospitality and customer service as well. Perhaps you can aim for positions in food, venues, and events promotion?",0,3,2
"why is the title 'women voters', that really doesnt flow well  
  
why not just female voters?  
  
you wouldnt say 'men voters', you'd say male voters",0,3,3
"IMO only the strong will survive. Monique Ryan is a teal who has done things I'm aware of (speak out against HECS indexation), the rest, I don't know what they are doing. These seats won't consign themselves to having minimal political influence in the long-term, they will likely return the seats to the Liberals in the next couple of elections.",0,3,0
Consumer court bro. Simple.,1,1,0
Bro uploaded his own pics and pretending it to be some monke. ![img](emote|t5_3d4x4|20028),1,3,3
Change India to Adania not Bharat.,1,1,1
"UK needs to sue Morocco and the areas of North Africa for the Barbary Corsair slave raiding all along the Western Coast of the British Isles and other countries on the Western seaboard of Europe.

'According to Robert Davis, author of Christian Slaves, Muslim Masters, between 1 million and 1.2 million Europeans were captured by Barbary pirates and sold as slaves in North Africa and The Ottoman Empire between the 16th and 19th centuries.'

That doesn't include the Ottomans of course who enslaved millions of Europeans too. 

Of course it's ludicrous to look at it this way. The whole history of human slavery needs to be taught. Conclusion: common in most societies throughout history.",2,2,2
"Americans... How do you live without kettles? How has ""much faster hot water"" not become a necessity?

You have spray can cheese. This was a higher priority for y'all?",0,3,2
How is telling people to be honest being shaddy?,0,3,0
I actually overheat if I have both my legs and torso fully covered above 15 degrees.,0,3,0
"How much marginal MW capacity would these even provide? It's not ""national security"" when the action doesn't make any meaningful changes.",2,3,0
"I like it. It's pretty chaotic and a lot happens in the short run time but the humour appeals to me. I'm glad it's doing well. 

Also hearing the cute optimistic Aussie accent is a nice change as Americans usually play us as some tough no BS character with a deeper voice.",0,0,0
