text,locale,ant-IN,ant-UK
"It isn't always about a sense of pride.

It is more about the market and what make sense economically.

For example you can see construction cranes and material conveyor belt like things being used by bigger companies because that gives them cost optimisation and they're able to compete with other modernized players

Whereas if you go to smaller towns or to people who do smaller scale work, they still use old methods.

Why?
1) The new methods needs a lot of skills, time and patience to reach a level of competency required for giving the customer the same set of deliverables as they do now.


2) Financial incentive: It is often a large captial expense required to make the switch for smaller setups who may not have credit access. And since the demand for that kind of work doesn't reward extra for  it being done by any modern method , there's no incentive.


3) Risk taking ability. Every new migration comes with challenges. So for example if you want a small store owner to begin to track his inventory and make sales  using a cloud solution they won't be ready to face an outage or the prospect of paying more for security or similar upgrades because it doesn't add that much value compared to the cost 

Lot of other things as well",1,2,2
"You have high expectations for what can be achieved in a 20 min speech. Budget reply isn't a shadow budget, they don't have any treasury resources.",0,3,2
"I thought someone from Brisbane was a Brisbonean.

Canberran

Novacastrian

Taswegian

But little known fact: people from Orange are call Fruits.",0,0,0
kings are just glorified landlords,1,2,2
Damn! How could I do such a blunder in typing.,1,3,2
"I always thought the expensive tickets and painfully expensive food and soft drinks were killing the whole movie going experience. Hopefully, if this works out for a few movies maybe the food and ticket prices will come down for good.",1,3,2
I would rather support a system that provides a wage over tipping culture.,0,3,2
Thank you for taking the time to write this. My wife is a GP partner and she is so pissed about the push for centralisation and the issues with these new roles. Just train and pay more doctors ffs.,2,0,2
